index,disease_name,description,"Possible Steps",image_url
0,Banana Healthy,"The leaf shows a vibrant green uniformity, a hallmark of Jalgaon's Grand Nain variety. Textures are smooth with strong leaf rib integrity and no necrotic streaking.","Continue current fertigation schedule. Maintain soil moisture at 70% field capacity. Monitor for early aphids or thrips as temperatures rise.",https://images.unsplash.com/photo-1594246001306-25f385c721ae
1,Banana Sigatoka,"Early identification of Sigatoka (Mycosphaerella fijiensis). Visible necrotic spots with yellow halos. This reduces the photosynthetic area, critical for high-yield Jalgaon plantations.","Immediately prune and burn infected leaves. Apply Prochloraz (1.5 ml/L) or Carbendazim. Inter-crop density should be decreased to improve air circulation.",https://images.unsplash.com/photo-1618588507085-c79565432967
2,Brinjal Healthy,"Foliage is broad and structurally sound. Underside of the leaf is free from mites or whiteflies. This indicates optimal nitrogen uptake in the loamy soils of the Tapti valley.","Use organic mulch to conserve moisture. Apply Neem-based organic fertilizer every 15 days to suppress soil-borne pathogens.",https://images.unsplash.com/photo-1594246001200-e5472bd1620a
3,Brinjal Leaf Spot,"Cercospora leaf spot detected. Visible as small, circular lesions with grey centers. Can lead to significant defoliation in Brinjal varieties like Manjari Gota if not controlled.","Avoid overhead irrigation to reduce humidity on leaves. Apply Mancozeb (2g/L) or Copper Oxychloride. Ensure 60x60cm spacing between plants.",https://images.unsplash.com/photo-1594246001210-e5472bd1621a
4,Cotton Bacterial Blight,"Angular water-soaked lesions observed, characteristic of Xanthomonas axonopodis. Common in Jalgaon's Bt-Cotton during humidity spikes following late monsoon rains.","Apply Streptocycline (100 ppm) mixed with Copper Oxychloride (0.3%). Avoid irrigation during high humidity periods. Destroy crop residue post-harvest.",https://images.unsplash.com/photo-1594246001150-e5472bd1619a
5,Cotton Healthy,"Leaf displays optimal palmate structure with healthy vein clarity. No signs of Jassids or sucking pests. Deep root penetration suggests balanced soil pH in black cotton soil.","Maintain balanced NPK ratio (100:50:50). Use yellow sticky traps for prophylactic monitoring of pest populations.",https://images.unsplash.com/photo-1594246001090-e5472bd1618a
6,Maize Common Rust,"Puccinia sorghi detected. Small, powdery cinnamon-brown pustules on both surfaces. This can reduce grain fill in Jalgaon's fodder and grain maize varieties.","Plant rust-resistant hybrids like Pioneer or Monsanto varieties. Apply Tebuconazole (1ml/L) at the first sign of pustules. Avoid early planting in rust-prone pockets.",https://images.unsplash.com/photo-1594246001230-e5472bd1623a
7,Maize Healthy,"Healthy long leaves with parallel venation and zero chlorosis. Strong culm support and well-defined whorl, indicating no internal stem borer damage.","Apply urea in split doses (at knee-high and tasseling stages). Monitor for Fall Armyworm (FAW) presence in central whorls.",https://images.unsplash.com/photo-1594246001220-e5472bd1622a
